{
  "eventId": "0c9d8e7f-6a5b-4c3d-8e1f-a2b3c4d5e6f7",
  "eventType": "NEWS_ARTICLE_INGESTED",
  "eventVersion": 1,
  "occurredAt": "2026-09-27T14:03:11.123Z",
  "source": "trading-core",
  "correlationId": "3f1c2a9e-4b7d-4c8e-9f0a-1b2c3d4e5f60",
  "symbol": "NVDA",
  "payload": {
    "articleId": "8a7b6c5d-4e3f-4a1b-9c8d-7e6f5a4b3c2d",
    "providerId": "example:123",
    "symbols": [
      "NVDA"
    ],
    "headline": "Chipmaker beats estimates",
    "source": "Example Wire",
    "url": "https://news.example.com/a/1",
    "publishedAt": "2026-09-27T14:03:11.123Z",
    "rawSummary": null,
    "contentHash": "9f86d081884c7d659a2feaa0c55ad015a3bf4f1b2b0b822cd15d6c15b0f00a08"
  }
}
