{
  "eventId": "0c9d8e7f-6a5b-4c3d-8e1f-a2b3c4d5e6f7",
  "eventType": "EXECUTION_RECORDED",
  "eventVersion": 1,
  "occurredAt": "2026-09-27T14:03:11.123Z",
  "source": "trading-core",
  "correlationId": "3f1c2a9e-4b7d-4c8e-9f0a-1b2c3d4e5f60",
  "accountId": "DU000000",
  "orderId": "3f1c2a9e-4b7d-4c8e-9f0a-1b2c3d4e5f60",
  "symbol": "NVDA",
  "payload": {
    "executionId": "8a7b6c5d-4e3f-4a1b-9c8d-7e6f5a4b3c2d",
    "brokerExecutionId": "0000e0d5.6512a3b1.01.01",
    "side": "BUY",
    "quantity": "4",
    "price": "184.26",
    "commission": null,
    "currency": "USD",
    "executedAt": "2026-09-27T14:03:11.123Z"
  }
}
