{
  "eventId": "0c9d8e7f-6a5b-4c3d-8e1f-a2b3c4d5e6f7",
  "eventType": "ORDER_FILLED",
  "eventVersion": 1,
  "occurredAt": "2026-09-27T14:03:11.123Z",
  "source": "trading-core",
  "correlationId": "3f1c2a9e-4b7d-4c8e-9f0a-1b2c3d4e5f60",
  "accountId": "DU000000",
  "orderId": "3f1c2a9e-4b7d-4c8e-9f0a-1b2c3d4e5f60",
  "symbol": "NVDA",
  "payload": {
    "clientOrderId": "c-20260927-0001",
    "brokerOrderId": "987654",
    "status": "FILLED",
    "previousStatus": "PARTIALLY_FILLED",
    "intent": "BUY",
    "brokerSide": "BUY",
    "orderType": "LIMIT",
    "quantity": "10",
    "filledQuantity": "10",
    "limitPrice": "184.25",
    "averageFillPrice": "184.21",
    "timeInForce": "DAY",
    "reason": null
  }
}
