{
  "eventId": "0c9d8e7f-6a5b-4c3d-8e1f-a2b3c4d5e6f7",
  "eventType": "BROKER_EXECUTION_OBSERVED",
  "eventVersion": 1,
  "occurredAt": "2026-09-27T14:03:11.123Z",
  "source": "realtime-gateway",
  "correlationId": "3f1c2a9e-4b7d-4c8e-9f0a-1b2c3d4e5f60",
  "accountId": "DU000000",
  "payload": {
    "brokerOrderId": "987654",
    "clientOrderRef": "c-20260927-0001",
    "observedStatus": "PARTIALLY_FILLED",
    "brokerStatusRaw": "PreSubmitted",
    "filledQuantity": "4",
    "remainingQuantity": "6",
    "averagePrice": "184.26",
    "execution": {
      "brokerExecutionId": "0000e0d5.6512a3b1.01.01",
      "quantity": "4",
      "price": "184.26",
      "executedAt": "2026-09-27T14:03:11.123Z"
    },
    "sourceTimestamp": "2026-09-27T14:03:11.123Z"
  }
}
