{
  "eventId": "0c9d8e7f-6a5b-4c3d-8e1f-a2b3c4d5e6f7",
  "eventType": "ORDER_FILLED",
  "eventVersion": 1,
  "occurredAt": "2026-09-27T14:03:11.123Z",
  "source": "trading-core",
  "correlationId": "3f1c2a9e-4b7d-4c8e-9f0a-1b2c3d4e5f60",
  "accountId": "DU000000",
  "orderId": "3f1c2a9e-4b7d-4c8e-9f0a-1b2c3d4e5f60",
  "symbol": "NVDA",
  "payload": {}
}
