{
  "eventId": "0c9d8e7f-6a5b-4c3d-8e1f-a2b3c4d5e6f7",
  "eventType": "NEWS_ARTICLE_ENRICHED",
  "eventVersion": 1,
  "occurredAt": "2026-09-27T14:03:11.123Z",
  "source": "ai-insights",
  "correlationId": "3f1c2a9e-4b7d-4c8e-9f0a-1b2c3d4e5f60",
  "symbol": "NVDA",
  "payload": {
    "articleId": "8a7b6c5d-4e3f-4a1b-9c8d-7e6f5a4b3c2d",
    "contentHash": "9f86d081884c7d659a2feaa0c55ad015a3bf4f1b2b0b822cd15d6c15b0f00a08",
    "enrichment": {
      "promptVersion": "news-insight.v1",
      "model": "provider-model-id",
      "modelVersion": "2026-09-01",
      "enrichedAt": "2026-09-27T14:03:11.123Z",
      "insight": {
        "summary": "Revenue beat expectations; guidance raised.",
        "sentiment": "POSITIVE",
        "sentimentScore": 0.72,
        "relevanceScore": 0.91,
        "catalysts": [
          {
            "type": "EARNINGS",
            "description": "Quarterly revenue above consensus."
          }
        ],
        "confidence": 0.86,
        "evidence": [
          "8a7b6c5d-4e3f-4a1b-9c8d-7e6f5a4b3c2d"
        ],
        "flags": []
      }
    }
  }
}
